questionId,caseStudy,question,correctAnswer,incorrectAnswers
q1,"A retailer is launching a holiday sale campaign and wants to maximize total revenue while avoiding stockouts. The analytics team proposes several metrics to prioritize opportunities.","Which metric best reflects whether the campaign generated additional revenue beyond normal demand?","Incremental revenue compared to baseline","Total website sessions|Number of social media followers|Average page load time"
q2,"A team is investigating churn. They can message users at-risk but outreach costs budget. They want a model output that helps prioritize outreach where intervention likely changes outcomes.","Which prediction target is most useful for this intervention strategy?","Uplift (treatment effect) on retention","Raw churn probability only|Number of support tickets|Most recent login timestamp"
q3,"A product manager runs an A/B test with statistically significant p-value but very small effect size. Engineering effort to roll out the feature is high.","What is the best decision framing?","Evaluate practical significance and expected business impact before rollout","Ship immediately because p-value is significant|Discard all A/B tests with low effect size|Increase sample size until effect looks larger"
q4,"A startup tracks activation by users completing onboarding within 7 days. Marketing introduces incentives that increase signups but not activation.","Which KPI should be optimized to align with sustainable growth?","Activated users per acquisition cost","Total signups|Ad impressions|Email open rate"
q5,"A fraud team can review only 5% of transactions manually. The model outputs risk scores. They need a thresholding strategy.","Which approach is most appropriate?","Set threshold to maximize precision at the review capacity constraint","Always use 0.5 probability threshold|Review random 5% for fairness only|Lower threshold until recall reaches 100%"